{
    "systolic_blood_pressure": {
        "value": 140,
        "unit": "mmHg"
    },
    "diastolic_blood_pressure": {
        "value": 60,
        "unit": "mmHg"
    },
    "body_posture": "sitting",
    "measurement_location": "left upper arm",
    "effective_time_frame": {
        "date_time": "2020-02-05T07:25:00-08:00"
    }
}